{
  "$schema": "../../../../../platform/src/main/resources/schema/map.schema.json",
  "schemaVersion": 1,
  "name": "dragonlobby",
  "world": "DragonLobby",
  "spawn": {
    "x": 34.0,
    "y": 84.0,
    "z": -171.0
  },
  "referenceTimeSeconds": 115.0,
  "boostConfig": {
    "burnDurationTicks": 30,
    "cooldownTicks": 40
  },
  "guideLine": {
    "lookAheadRings": 2,
    "particleSpacing": 1.0,
    "points": []
  },
  "rings": [
    {
      "index": 0,
      "center": {
        "x": 101.0,
        "y": 66.0,
        "z": -229.0
      },
      "normal": {
        "x": 1.0,
        "y": 0.0,
        "z": 0.0
      },
      "radius": 4.47213595499958,
      "points": 10,
      "type": "STANDARD"
    },
    {
      "index": 1,
      "center": {
        "x": 157.0,
        "y": 35.0,
        "z": -180.0
      },
      "normal": {
        "x": 0.0,
        "y": 0.0,
        "z": 1.0
      },
      "radius": 3.605551275463989,
      "points": 10,
      "type": "STANDARD"
    },
    {
      "index": 2,
      "center": {
        "x": 163.0,
        "y": 36.0,
        "z": -120.0
      },
      "normal": {
        "x": 0.0,
        "y": 0.0,
        "z": 1.0
      },
      "radius": 4.47213595499958,
      "points": 10,
      "type": "STANDARD"
    },
    {
      "index": 3,
      "center": {
        "x": 201.0,
        "y": 35.0,
        "z": -85.0
      },
      "normal": {
        "x": 0.0,
        "y": 0.0,
        "z": 1.0
      },
      "radius": 3.605551275463989,
      "points": 10,
      "type": "STANDARD"
    },
    {
      "index": 4,
      "center": {
        "x": 138.0,
        "y": 61.0,
        "z": -6.0
      },
      "normal": {
        "x": 0.0,
        "y": 1.0,
        "z": 0.0
      },
      "radius": 5.385164807134504,
      "points": 10,
      "type": "STANDARD"
    },
    {
      "index": 5,
      "center": {
        "x": 138.0,
        "y": 75.0,
        "z": -6.0
      },
      "normal": {
        "x": 0.0,
        "y": 1.0,
        "z": 0.0
      },
      "radius": 5.385164807134504,
      "points": 10,
      "type": "STANDARD"
    },
    {
      "index": 6,
      "center": {
        "x": 157.0,
        "y": 93.0,
        "z": 25.0
      },
      "normal": {
        "x": 0.0,
        "y": 0.0,
        "z": 1.0
      },
      "radius": 5.385164807134504,
      "points": 10,
      "type": "STANDARD"
    },
    {
      "index": 7,
      "center": {
        "x": 194.0,
        "y": 100.0,
        "z": 108.0
      },
      "normal": {
        "x": 0.0,
        "y": 0.0,
        "z": 1.0
      },
      "radius": 5.385164807134504,
      "points": 10,
      "type": "STANDARD"
    },
    {
      "index": 8,
      "center": {
        "x": 210.0,
        "y": 100.0,
        "z": 124.0
      },
      "normal": {
        "x": 1.0,
        "y": 0.0,
        "z": 0.0
      },
      "radius": 5.385164807134504,
      "points": 10,
      "type": "STANDARD"
    },
    {
      "index": 9,
      "center": {
        "x": 226.0,
        "y": 100.0,
        "z": 108.0
      },
      "normal": {
        "x": 0.0,
        "y": 0.0,
        "z": -1.0
      },
      "radius": 5.385164807134504,
      "points": 10,
      "type": "STANDARD"
    },
    {
      "index": 10,
      "center": {
        "x": 210.0,
        "y": 93.0,
        "z": 92.0
      },
      "normal": {
        "x": -1.0,
        "y": 0.0,
        "z": 0.0
      },
      "radius": 5.385164807134504,
      "points": 10,
      "type": "STANDARD"
    },
    {
      "index": 11,
      "center": {
        "x": 166.0,
        "y": 126.0,
        "z": 77.0
      },
      "normal": {
        "x": 0.0,
        "y": 1.0,
        "z": 0.0
      },
      "radius": 5.385164807134504,
      "points": 10,
      "type": "STANDARD"
    },
    {
      "index": 12,
      "center": {
        "x": 129.0,
        "y": 156.0,
        "z": 65.0
      },
      "normal": {
        "x": -1.0,
        "y": 0.0,
        "z": 0.0
      },
      "radius": 5.385164807134504,
      "points": 10,
      "type": "STANDARD"
    },
    {
      "index": 13,
      "center": {
        "x": 78.0,
        "y": 146.0,
        "z": 22.0
      },
      "normal": {
        "x": 0.0,
        "y": 0.0,
        "z": -1.0
      },
      "radius": 5.385164807134504,
      "points": 10,
      "type": "STANDARD"
    },
    {
      "index": 14,
      "center": {
        "x": 23.0,
        "y": 131.0,
        "z": -4.0
      },
      "normal": {
        "x": -1.0,
        "y": 0.0,
        "z": 0.0
      },
      "radius": 5.385164807134504,
      "points": 10,
      "type": "STANDARD"
    },
    {
      "index": 15,
      "center": {
        "x": -21.0,
        "y": 118.0,
        "z": 24.0
      },
      "normal": {
        "x": 0.0,
        "y": 0.0,
        "z": 1.0
      },
      "radius": 5.385164807134504,
      "points": 10,
      "type": "STANDARD"
    },
    {
      "index": 16,
      "center": {
        "x": -17.0,
        "y": 140.0,
        "z": 271.0
      },
      "normal": {
        "x": 0.0,
        "y": 0.0,
        "z": 1.0
      },
      "radius": 5.385164807134504,
      "points": 10,
      "type": "STANDARD"
    },
    {
      "index": 17,
      "center": {
        "x": 12.0,
        "y": 97.0,
        "z": 338.0
      },
      "normal": {
        "x": 1.0,
        "y": 0.0,
        "z": 0.0
      },
      "radius": 4.47213595499958,
      "points": 10,
      "type": "STANDARD"
    },
    {
      "index": 18,
      "center": {
        "x": 119.0,
        "y": 61.0,
        "z": 266.0
      },
      "normal": {
        "x": 0.0,
        "y": 0.0,
        "z": -1.0
      },
      "radius": 5.385164807134504,
      "points": 10,
      "type": "STANDARD"
    },
    {
      "index": 19,
      "center": {
        "x": 128.0,
        "y": 64.0,
        "z": 107.0
      },
      "normal": {
        "x": -1.0,
        "y": 0.0,
        "z": 0.0
      },
      "radius": 5.385164807134504,
      "points": 10,
      "type": "STANDARD"
    },
    {
      "index": 20,
      "center": {
        "x": 34.0,
        "y": 72.0,
        "z": 109.0
      },
      "normal": {
        "x": -1.0,
        "y": 0.0,
        "z": 0.0
      },
      "radius": 5.385164807134504,
      "points": 10,
      "type": "STANDARD"
    },
    {
      "index": 21,
      "center": {
        "x": -90.0,
        "y": 56.0,
        "z": 116.0
      },
      "normal": {
        "x": -1.0,
        "y": 0.0,
        "z": 0.0
      },
      "radius": 5.385164807134504,
      "points": 10,
      "type": "STANDARD"
    },
    {
      "index": 22,
      "center": {
        "x": -191.0,
        "y": 74.0,
        "z": 122.0
      },
      "normal": {
        "x": 0.0,
        "y": 1.0,
        "z": 0.0
      },
      "radius": 5.385164807134504,
      "points": 10,
      "type": "STANDARD"
    },
    {
      "index": 23,
      "center": {
        "x": -190.0,
        "y": 86.0,
        "z": 78.0
      },
      "normal": {
        "x": 0.0,
        "y": 0.0,
        "z": -1.0
      },
      "radius": 5.385164807134504,
      "points": 10,
      "type": "STANDARD"
    },
    {
      "index": 24,
      "center": {
        "x": -193.0,
        "y": 86.0,
        "z": -16.0
      },
      "normal": {
        "x": 0.0,
        "y": 0.0,
        "z": -1.0
      },
      "radius": 5.385164807134504,
      "points": 10,
      "type": "STANDARD"
    },
    {
      "index": 25,
      "center": {
        "x": -161.0,
        "y": 46.0,
        "z": -118.0
      },
      "normal": {
        "x": 0.0,
        "y": 0.0,
        "z": -1.0
      },
      "radius": 5.385164807134504,
      "points": 10,
      "type": "STANDARD"
    },
    {
      "index": 26,
      "center": {
        "x": -143.0,
        "y": 42.0,
        "z": -234.0
      },
      "normal": {
        "x": 1.0,
        "y": 0.0,
        "z": 0.0
      },
      "radius": 5.385164807134504,
      "points": 10,
      "type": "STANDARD"
    },
    {
      "index": 27,
      "center": {
        "x": -38.0,
        "y": 51.0,
        "z": -221.0
      },
      "normal": {
        "x": 0.0,
        "y": 0.0,
        "z": 1.0
      },
      "radius": 5.385164807134504,
      "points": 10,
      "type": "STANDARD"
    },
    {
      "index": 28,
      "center": {
        "x": -5.0,
        "y": 87.0,
        "z": -168.0
      },
      "normal": {
        "x": 1.0,
        "y": 0.0,
        "z": 0.0
      },
      "radius": 5.385164807134504,
      "points": 10,
      "type": "STANDARD"
    }
  ],
  "notes": [
    "Converted from the legacy Voyager plugin H2 database (map 'DragonLobby', author Seelenretterin, display name <gradient:#ff55ff:blue:-1>DragonLobby</gradient>) by tools/convert_rings.py + tools/write_maps.py.",
    "Ring centre = the legacy CENTER point (integer block coords, no +0.5). Radius = mean centre-to-rim distance. Normal = least-squares plane normal of the rim, signed along the flight direction; normals are snapped to an axis only when the ring lies exactly in an axis plane; tilted rings keep the best-fit normal.",
    "Placeholders: spawn is the old level.dat spawn (34, 84, -171); referenceTimeSeconds 115.0 is a guess (path length 2299 blocks / 20 blocks per second); points 10 per ring; all rings STANDARD; boostConfig 30/40; guideLine has no points.",
    "Rings to check in game (index: reason): 22: flow"
  ]
}
